Topic,Description
Pre-training and Fine-tuning Procedures for NLP Models,This theme discusses the process of pre-training and fine-tuning language models like BERT for improved performance on downstream natural language processing tasks.
Deep Language Model Pre-training,"This theme covers the use of deep bidirectional transformers, pre-training procedures, and their applications in improving language understanding and representation."
BERT Architecture and Pre-training Methods,"This theme covers various aspects of the BERT model, including input representation, pre-training approaches, and fine-tuning techniques."
Natural Language Processing (NLP) Applications and Evaluation,"This theme explores the applications of BERT in NLP tasks, such as sentence relationship prediction, next sentence prediction, and task-specific fine-tuning, with a focus on evaluation metrics and best practices."
Pre-training Task Variations and Model Adaptation,"This theme examines the impact of varying pre-training tasks on model performance and adaptation, discussing the effects of different architectures, task removals, and model sizes on fine-tuning outcomes."
Advances in Pre-Training and Fine-Tuning Approaches,"This theme discusses recent advancements in pre-training and fine-tuning approaches for natural language processing models, including techniques such as masked language modeling and next sentence prediction."
Fine-Tuning and Model Performance Evaluation,"This theme explores the process of fine-tuning pre-trained language models for specific tasks, evaluating their performance, and optimizing hyperparameters to achieve better results in various NLP applications."
